case_id,source_type,text_ko,target_lang,raw_translation,post_processed_translation,problem_type,term_or_slot,expected_fix,status,note
FAIL-001,eval,강좌: 이야기한국사 / 모집대상: 1-3학년 / 요일: 수 / 학기 중 시간: A 13:30~15:10 / 방학 중 시간: A 09:00~10:40 / 장소: 본관4층 교과2실 / 11차시 수강료 81,950원 / 교재비 12,000원 / 재료비 24,000원,vi,"Lời bài hát: Lời bài hát: Lời bài hát: Lời bài hát: Lời bài hát: Lời bài hát: Lời bài hát: ...",N/A,repetition,수강료/교재비/재료비,repetition_penalty=1.5 + no_repeat_ngram_size=4 적용,open,SCHOOL-KO-005. 강좌명 앞부분에서 반복 시작. 전체 의미 소실.
FAIL-002,eval,"2026년 월 일보호자 : (인)서울송파초등학교 귀하 학교장 확인사항 종 목전( )학년 수업일수 결석일수 출석인정결석 출석인정조퇴",vi,"Chương trình giảng dạy năm 2026: Chương trình giảng dạy giáo dục giáo dục giáo dục giáo dục ... (x50+)",N/A,repetition,학년/출석/결석/조퇴,repetition_penalty=1.5 + no_repeat_ngram_size=4 적용,open,SCHOOL-KO-006. '교육' 반복. 서식 구조 완전 파괴.
FAIL-003,eval,강좌: 창의과학실험 / 모집대상: 1-2학년(정원15명) / 요일: 목 / 학기 중 시간: A 13:30~15:10 / 방학 중 시간: A 09:00~10:40 / 장소: 본관2층 해누리터 / 12차시 수강료 89,400원 / 교재비 48,000원,vi,"Chương trình giảng dạy: Chương trình giảng dạy: Chương trình giảng dạy: ... (x24+)",N/A,repetition,수강료/교재비,repetition_penalty=1.5 + no_repeat_ngram_size=4 적용,open,SCHOOL-KO-010. 강좌명 패턴에서 반복 트리거.
FAIL-004,eval,"강좌: 3D스팀펜 / 모집대상: 1-6학년 / 요일: 수 / 학기 중 시간: A 13:30~15:10 / 방학 중 시간: A 9:00~10:40 / 장소: 본관4층 실과실 / 11차시 수강료 81,950원 / 교재비 55,000원",vi,"Các khóa học: 3D Student Pen / ... / Phòng học 11 lớp học học: 89.950 USD / phí học tập 55.000 USD",N/A,slot_loss,수강료(원),slot masking으로 금액 격리 — 81950 won,open,SCHOOL-KO-012. 81950원 → 89.950 USD (금액+단위 동시 오역). slot 마스킹으로 해결 가능.
FAIL-005,eval,1) 담임교사 수업공개 대상 학년교과시간참관 장소교사참관대상1학년창체2교시(9:50~10:30)해당 교실담임대상학급학부모2학년창체3학년창체6교시(13:40~14:20)4학년창체5학년창체6학년국어,vi,"học sinh học sinh học sinh học sinh học sinh ... (x60+)",N/A,repetition,담임교사/학년/교과,repetition_penalty=1.5 + no_repeat_ngram_size=4 적용,open,SCHOOL-KO-018. 테이블 형식 입력에서 반복. 학년/교과 구조 완전 소실.
FAIL-006,eval,e알리미로 4월 15일(수)까지 동의 관련 서명을 해 주시거나 학생이 등교시 담임선생님께 동의서를 제출해 주시면 됩니다.,vi,Bạn có thể ký kết thông qua e-mail cho đến ngày 15 tháng 4 hoặc gửi thông qua sự đồng ý của bạn cho giáo viên.,N/A,semantic_drift,담임선생님,giáo viên chủ nhiệm (후처리 교정),open,SCHOOL-KO-007. 'e알리미'→'e-mail' 오역. 담임선생님 → giáo viên (담임 특정 없음). vi 후처리로 담임 교정 가능.
FAIL-007,eval,2026학년도 6학년 1학기 1일형 현장체험학습 참가 신청서 원하는 곳에 표하여 4월 20일(월)까지 담임선생님께 제출 바랍니다(기한 엄수).,vi,Đơn xin tham gia học tập 1 ngày trường học năm 2026 cho học viên quản lý vào ngày 20 tháng 4 năm 2026.,N/A,semantic_drift,학생,học sinh (학viên 아님),vi 후처리 패턴 적용,open,SCHOOL-KO-001. '학생' → 'học viên'(대학원생) 오역. postprocess_vi.py STUDENT 패턴으로 교정 가능.
FAIL-008,eval,"본교에서는 전교생을 대상으로 무상 우유급식을 실시하고 있습니다. 우유미급식 신청서는 3월 5일(목)16:00까지 e-알리미로 제출하여 주시기 바랍니다.",vi,"Trường trung ương đang thực hiện bữa tiệc sữa miễn phí cho các sinh viên, nhưng nếu có vấn đề sức khỏe...",N/A,semantic_drift,전교생/우유급식,học sinh (sinh viên 아님) + 급식 도메인 용어 보강,open,SCHOOL-KO-008. '전교생'→'sinh viên(대학생)' 오역. 우유급식 관련 용어 glossary 보강 필요.
